id,clean_token,cluster
380,high deck warbonnet peak immaculate wind river mountain naming range quickly make sense windproof stretchy lightweight jacket protect warm polartec windbloc laminate sandwich polyester microfleece face high grid polyester interior unlaminated underarm panel      recycle polyester enhance breathability mobility neck gasket seal element seamless shoulder allow pack wear comfort external pocket handwarmer stay clear harness internal drop pocket drawcord recyclable common thread recycle program detail lightweight durable microfleece face stretch polartec windbloc laminate interior grid construction speed wicke nonlaminate fabric enhance mobility breathability drawcord collar supplex stand protective chin flap comfort seamless shoulder comfort pack pocket handwarmer chest internal drop drawcord fabric lightweight shell polartec windbloc polyester microfleece laminate polartec power polyester panel       polartec power polyester      recycle spandex recyclable common thread recycle program weight       colombia,-1
381,modern mountain staple adaptable jacket serve stand outer layer superb insulate layer shell stretchy polyester knit variable length fiber optimize insulation compressibility afford outstanding breathability warmth moisture management minimal weight stretchy fabric recycle polyester inside collar cuff enhance skin comfort pliable body fabric mean easily easy zipper glue zippered pocket chest handwarmer forward shoulder seam pack wear comfort recyclable common thread recycle program detail highly technical fabric light stretchy compressible great breathability insulate long fiber alternate dense supportive short fiber optimize insulation reduce bulk directional knit wick moisture speed time inner collar line fabric recycled polyester skin comfort collar protective chin flap line fabric recycled polyester skin comfort bulk fabric cuff pocket chest zipper handwarmer zipper weld reinforce supplex snag free operation shoulder seam forward pack wear comfort fabric shell       polartec thermal polyester      recycle fleece panel       polartec power polyester      recycle spandex recyclable common thread recycle program weight       colombia,-1
382,rain shadow stay inside stay enjoy trail condition fully seam seal waterproof breathable protection rain shadow packable lightweight tear resistant      layer nylon fabric waterproof breathable barrier deluge durable water repellent finish inside raise pattern diffuse channel moisture away skin hassle free layering enhance long term durability update microfleece lining neck chin waterproof handwarmer pocket long mesh line zipper garage external zipper water resistant storm flap feature roll adjustable helmet compatible hood center zipper self fabric cuff drawcord detail      layer tear resistant fabric waterproof breathable barrier deluge durable water repellent finish highly engineer interior surface texture channel moisture away skin protect waterproof barrier abrasion slide easily layer roll adjustable hood laminate visor improved hood structure visibility poor condition microfleece line neck chin comfort enhance protection barrier exterior zipper center handwarmer pocket zips water resistant coating extra storm flap hook loop closure waterproof handwarmer pocket mesh line update custom zipper pull profile laminate self fabric cuff tabs drawcord fabric      layer       nylon waterproof breathable barrier deluge finish weight      vietnam,0
383,everyday sock essential daily grind exceptionally soft wearable sock invite organic cotton stretch nylon spandex moisture wicke skin comfort open grid foot loop lintoe construction combine create excellent airflow breathability kick foot foot comfort jersey knit cuff extend calf height      detail organic cotton nylon blend ideal everyday fabric content strategic knit balance moisture wicke cushioning durability comfort open grid foot allow excellent airflow breathability loop lintoe construction create small flat seam possible ultimate comfort fabric organic cotton nylon spandex weight     ,-1
384,guide pant backcountry version immensely popular simple guide lightweight guide pant combine skiing alpine climb feature lightweight free moving highly breathable stretch weave fabric resist moisture provide mountain worthy durability allow spring weight underlayer brisk alpine start gussete crotch reinforce articulate knee allow unrestrained mobility zippered gussete cuff adjust boot girth snap closure feature loop crampon edge scuff guard belt loop pocket hand glue right thigh close laser glue zipper recyclable common thread recycle program detail lightweight stretch weave polyester double weave durable water repellent finish gussete crotch separate waist pull belt loops pocket zippered handwarmer zippered thigh right glue thigh zipper hand thigh laser glue reinforce knee resist abrasion articulate knee crampon edge scuff guard zipper snap gusset gripper elastic loop ankle cuff fabric      recycle polyester spandex double weave deluge durable water repellent finish recyclable common thread recycle program weight       thailand,-1
385,hiking crew liner sock liner brunt ramble lightweight warmth cold condition reduce chafing pair sock foot cool wear solo swelter weather jersey knit construction polyester      recycle nylon superior moisture transport quick performance absolute durability      spandex provide shape retention loop lintoe construction provide comfort height      detail lightweight polyester nylon blend strategically knit excellent wicking speedy time loop lintoe construction create small flat seam possible ultimate comfort fabric recycle polyester nylon spandex weight     ,-1
386,storm light emerge classic inspire original storm jacket hold true timeless trait waterproof breathable comfortable build warm weather engineer recycle storm light keep motion lowland trek high mountain pass waterproof breathable protection combine hang mesh taffeta liner soft pliable comfortable feel storm flap cover zips external zippered pocket center zipper detail include soft chamois chin guard adjustable hood roll microfleece line collar internal drop pocket drawcord cuff secure self fabric recyclable common thread recycle detail layer polyester fabric waterproof breathable barrier hang mesh taffeta liner great comfort adjustable stowable hood soft chamois chin guard storm flap center zipper zips external pocket zipper pocket external left chest handwarmer internal drop cuff secure self fabric drawcord fabric shell layer deni      polyester laminate waterproof breathable barrier deluge durable water repellent finish shell lining       recycle polyester mesh hood lining       deni recycle polyester taffeta collar lining chin flap       polyester brush jersey recyclable common thread recycle program weight      china,0
387,stretch ascent simple stretchy lightweight waterproof alpine climb reality include sideway blow sleet stretch ascent jacket provide stormproof protection extraordinary breathability stretch weave polyester      recycle waterproof breathable barrier combine pliable      layer fabric package enable limber move roll helmet compatible hood adjust easy single pull system water resistant coated center zipper remain easy open close water resistant external pocket zipper zipper garage pocket internal drop cuff secure self fabric drawcord route pocket hood structured visor improve visibility poor condition recyclable common thread recycle program detail waterproof breathable       layer stretch woven shell helmet compatible roll single pull adjustable hood laminate visor zipper offer extreme water resistance easy pocket zippered handwarmer zipper garage internal drop cuff secure self fabric hook loop cuff closures drawcord route pocket fabric      layer deni      recycle stretch weave polyester waterproof breathable barrier deluge durable water repellent finish recyclable common thread recycle program weight       vietnam,0
388,hoody highly evolved second skin design maximize time water simultaneous conditioning tough protection super breathable fast hoody lightweight polyester jersey panel hood protect head closure pocket keep hand line sort thumb loop cuff coverage recyclable common thread recycle program detail soft supple polyester fabric protection panel self fabric hood provide airy ventilate protection thumb loop cuff coverage protection zipper pocket flat seam reduce chafe fabric      polyester jersey protection recyclable common thread recycle program weight      vietnam,-1
389,travel courier graceful rendition courier sleek nearly weightless zippered closure adjustable drawstring zippered security pocket bike light prayer bead breathable adjustable shoulder strap comfortable quick stuff pocket easy stowing strong extremely lightweight deni triple ripstop nylon polyurethane coating durable water repellent finish reinforcement denier polyester      recycle double weave shiftlayer detail main compartment access zippered closure adjustable drawstre zipper security pocket clip stuff pocket breathable shoulder strap ultralight quick adjustable extremely lightweight triple ripstop fabric afford excellent tear resistance fabric deni nylon triple ripstop polyurethane coating durable water repellent finish reinforcement deni polyester      recycle double weave shiftlayer weight      philippine,-1
390,organic jean short       organic cotton denim obsession detail right jean occasion rugged soft organic cotton denim break right feature button closure pocket jean styling available distinct wash inseam length short      regular      long      look good year wear recycle common thread recycle program detail durable soft organic cotton denim button closure pocket jean style inseam fabric organic cotton denim recyclable common thread recycle program weight mexico,10
391,relax organic jean long everyday rarely wash favorite relaxed organic cotton pocket jean build long life comfort mobility clean classic styling wear robust organic cotton denim break right available inseam length short      regular      long      recyclable common thread recycle program detail durable organic cotton denim button closure pocket jean styling inseam fabric organic cotton denim recyclable common thread recycle program weight mexico,10
392,relax organic jean everyday rarely wash favorite relaxed organic cotton pocket jean build long life comfort mobility clean classic styling wear robust organic cotton denim break right available inseam length short      regular      long      recyclable common thread recycle program detail durable organic cotton denim button closure pocket jean styling inseam fabric organic cotton denim recyclable common thread recycle program weight mexico,10
393,travel sling feel open like good itinerary feature traveler need lightweight fabric allow travel mold shape keep load close center balance main compartment roomy lunch shell extra space find treasure organizational pocket chain clip hold easily lose item shoulder strap include electronics pocket phone music player mesh water bottle pocket keep favorite liquid handy travel point adjustable mesh shoulder strap entire pack stuff pocket deni nylon triple ripstop polyurethane coating durable water repellent finish detail zipper main compartment internal pocket organization pocket internal chain clip mesh water bottle pocket breathable mesh shoulder strap electronics pocket point adjustable shoulder strap waistbelt stow pocket fabric body deni nylon triple ripstop polyurethane coating durable water repellent finish shoulder strap      polyester spacer mesh weight      philippine,1
394,travel tote harmonize life travel tote hold farmer market beach essential plein watercolor feature large zippered main compartment easy access external zippered organizer pocket keeper swallow entire handy internal pocket valuable mesh pocket drink bottle snack cinch drawcord buckle secure content attach lightweight item breathable backpack strap store lightweight foam cushion remove deni triple ripstop nylon polyurethane coating durable water repellent finish reinforce deni polyester      recycle double weave shiftlayer detail zipper main compartment provide easy access zipper organizer pocket keeper stow tote inside zippered pocket hold valuable mesh pocket bottle snack cinch drawcord buckle secure content attach lightweight item breathable shoulder strap stow lightweight foam cushion remove fabric deni nylon triple ripstop polyurethane coating durable water repellent finish reinforcement deni polyester      recycle double weave shiftlayer weight      philippine,-1
395,wavefarer board short board short live long hike secret spot long hour water surf trunk chafe proof forward inseam crotch tried true wavefarer rise knee prevent rash build tough lightweight quick      nylon durable water repellent finish detail include flat single button easy access self drain pocket loop inseam size outseam recyclable common thread recycle program detail recyclable lightweight nylon durable water repellent finish flat single button piece self line waistband contour line horizontal self drain seam pocket secure internal loop forward inseam crotch eliminate chafe knee rise inseam outseam fabric      nylon finish recyclable common thread recycle program weight      thailand,-1
396,wild steelhead alaska poster catch release steelhead disappear cold clear water alaskas eagle river year tribute human adventure near collection photograph speak passion beauty life spend outside photo appear exclusively site catalog wall retail store specialty outdoor clothier world excited select photo available poster hope brighten space inspire outside detail dimensions photo pask patagonia fabric print recycle paper print,6
397,wind path shirt visual energy wind path shirt draft hide current beautifully render artist nick wroblewski ringspun      organic cotton supersoft tape shoulder seam provide chafe shirt phthalate free easy environment recyclable common thread recycle program detail ringspun yarn soft hand tape shoulder seam screen print phthalate free fabric      organic cotton recyclable common thread recycle program weight     ,4
398,marlwalker stalk coral flat tough foot tough emotion fortunately classic flat shoe provide comfort support protection foot flat angler appreciate light flexible notch flex zone allow natural foot movement fast marlwalker know killer durability favorite flat guide boot style protection support reduce fatigue maximize stability upper tough quick synthetic leather ultra high filtration hydrophobic polyester mesh      recycle feature hide lace eyelet neoprene spandex tongue cushion heel cushion wraparound ankle support sturdy nonmarke rubber sole neoprene collar wide detail quick synthetic leather comfortable lightweight wade shoe high filtration mesh keep sand silt drain quickly compression mold midsole polypropylene insole shank combination provide torsional rigidity support protection stone bruising insole provide comfort arch support wide accommodate neoprene foot wader insulator sock ankle support cover protect lace loop speed lace hook notch sculpt flex zone improved flexibility highly abrasion resistant bumper stout reinforce toebox heel counter sole design hold straps sticky rubber star tread pattern sole provide excellent multi directional traction stream rocks outsole resole fabric high filtration recycle polyester mesh synthetic leather upper nylon spandex neoprene tongue polypropylene insole board length mold midsole weight      china,-1
399,marlwalker pant veteran tropic know long pant good beat damage effect heat salt sand coral need right pair marlwalker pant provide protection light airy performance water extremely fast nylon fabric resist water absorption prevent chafing fully recyclable high tear strength mean marlwalker stand year pound surf abrasive jetty rock occasional shore crab streamline flapless zippered pocket self drain will grab line string closure button recyclable common thread recycle program detail extremely fast fabric resist prevent chaff provide protection high tear strength promote long product life harsh condition provide wind protection shut airflow rear pocketing self drain internal loop flat button closure inseam size fabric      nylon durable water repellent finish protection recyclable common thread recycle program weight      thailand,-1
400,retro grade short advantageous number retro grade soft durable blend organic cotton spandex stay cool slide smoothly skin gussete crotch articulation knee unchallenged build soft waist internal drawstring harness compatible belt loop feature relaxed pocket design include security pocket right seam long short inseam size recyclable common thread recycle program detail soft durable organic cotton spandex stretch easy slide skin pocket styling relaxed grow waistband harness comfort internal synthetic drawstre gussete crotch angle easy access zipper security pocket seam double layered fabric knee articulation knee inseam fabric organic cotton spandex recyclable common thread recycle program weight      vietnam,-1
401,reversible phone home travel broadly surf world forget reversible road trip rejuvenation inimitable hooded phone home jacket help touch organic cotton fleece line soft organic cotton jersey come extended knit waist cuff roomy pocket fleecy recyclable common thread recycle program detail organic cotton fleece hoody line organic cotton jersey knit waist cuffs drawstre closure hood roomy pocket reversible fabric      organic cotton fleece lining       organic cotton jersey recyclable common thread recycle program weight      india,-1
402,river short river life mighty fine occasionally wear clothe river short provide quick alternative life naturel light skin friendly      nylon fabric venerable baggie short durable water repellent finish resist water polyester mesh lining roll inner seam forward eliminate chafing rear yoke customize thigh pocket hold river essential waistband belt loop belt separate buckle keep cinch happen drink inseam length size recyclable common thread recycle program detail quick baggie nylon durable water repellent finish pull elasticize waistband black mesh liner belt belt loop separate buckle self drain pocket rear zippered pocket horizontal self drain pocket internal loop forward inseam crotch eliminate chafe inseam fabric      nylon durable water repellent finish lining       polyester mesh recyclable common thread recycle program weight nicaragua,14
403,pack entrust hold essential little pack responsibility design hiking biking travel feature zippered main compartment small hang mesh pocket retainer spacer mesh panel wick perspiration narrow waist strap water resistant zipper denier double weave polyester      recycle coat polyurethane durable water repellent finish detail zipper main compartment hold good hang mesh pocket small item retainer spacer mesh panel cushion wick moisture quickly allow circulation narrow waistbelt comfortable unobtrusive water resistant zippers fabric      deni recycle polyester double weave lining       deni polyester polyurethane coating durable water repellent finish weight      vietnam,1
404,hood monk sweatshirt sacred garment predawn surf check sunset barbecue skateboard beer ultimate sweatshirt hoody sport graphic shirt line organic cotton polyester fleece softness quick surf time extended knit cuff waist recyclable common thread recycle program detail soft organic cotton polyester fabric deep panel hood drawcord pouch pocket extend knit cuff waist fabric      organic cotton polyester fleece recyclable common thread recycle program weight      india,-1
405,houdini like blustery ultralight ultrapackable houdini shed fickle weather disappear clear breathable crank squall texture triple ripstop nylon fabric prove surprisingly tough deluge durable water repellent finish ward flurry pitch deck volume hood snug face head dimensionally single pull system jacket stuff chest pocket secure zipper closure burly strong carabiner clip loop drawcord detail highly breathable incredibly light texture soft shell fabric strong triple ripstop pattern subtle slightly transparent appearance deluge durable water repellent finish coated center zipper zipper exterior chest pocket double stuff sack reinforce carabiner clip loop hood opening field vision adjustment pull wear baselayer light midlayer fabric deni nylon ripstop deluge finish recyclable common thread recycle program weight      china,-1
406,merino bottom stop pace like alpine climbing backcountry riding leave shiver lightweight bottom help stay warm versatile merino layer active lifestyle warm cool weather merino merino wool spin recycle polyester      core luxurious hand improve time endure strength inherently soft comfortable merino naturally resist odor move moisture away skin regulate body temperature stretch detail include brush elastic waistband offset inseam functional slow wash merino skin softness machine wash cold flat recyclable common thread recycle program detail slow wash merino wool resist odor naturally insulate durable stretch provide superior performance softness      micron gauge yarn jersey knit construction luxurious hand recycle polyester core wick moisture wool skin controls odor brush elastic waistband offset inseam prevent irritation functional machine wash cold flat fabric           chlorine free merino wool recycle polyester recyclable common thread recycle program weight     ,8
407,merino crew soft long sleeve work sweat biking work catch bouldering session afternoon people want near inherently soft comfortable merino naturally resist odor move moisture away skin regulate body temperature stretch versatile merino layer active lifestyle warm cool weather lightweight pullover feature merino wool spin recycle polyester      core luxurious hand improve time endure strength raglan sleeve design offset seam smooth beneath pack strap slow wash merino skin softness machine wash cold flat recyclable common thread recycle program detail slow wash merino wool resist odor naturally insulate durable stretch provide superior performance softness      micron gauge yarn jersey knit construction luxurious hand recycle polyester core wick moisture wool skin controls odor self fabric collar band comfort bind raglan sleeve seam will chafe beneath pack strap seam offset eliminate irritation machine wash cold flat fabric           chlorine free merino wool recycle polyester recyclable common thread recycle program weight     ,8
408,baggie short summertime unwind boisterous flurry sunshine water baggie short flow effortlessly chaos quiet time easy going feel lightweight quick       supplex nylon durable water repellent finish shed water self drain half mesh pocket bartacke stress point fully elasticize drawcord waist hold beanpole self fabric backing chafe comfort build mesh liner inseam recyclable common thread recycle program detail lightweight supplex nylon quickly elasticize drawcord waist soft fabric mesh liner half mesh pocket drainage tack pocket seam stress point inseam fabric       supplex nylon durable water repellent finish recyclable common thread recycle program weight      nicaragua,14
409,boardie short grom tear shre short boardie provide long haul core durability lightweight      microfiber polyester fabric treat durable water repellent finish slightly long length forward seaming crotch improve mobility comfort partially elasticize waistband adjust nylon drawcord closure zippered pocket flat self drain ride unlined inseam recyclable common thread recycle program detail soft durable lightweight micropolyester quick partially elasticize waistband perfect comfort length provide ample coverage abrasion resistance straddle surfboard forward seaming crotch create mobility comfort board short inspire closure secure easy adjust nylon drawcord zipper pocket flat self drain riding unlined inseam fabric      microfiber polyester brush face durable water repellent finish recyclable common thread recycle program weight      colombia,-1
410,glove look flat guide hand pretty good idea course sunscreen tend slippery work casting line control want coconut scented solution light comfortable fingerless glove quick recycle polyester spandex fabric finger design seam placement glove easy wear easy slip hand thank detail recycle polyester spandex glove protection seam place away traditional wear area finger design secure comfortable easy fabric      recycle polyester spandex weight     ,-1
411,mask protection work comfort mean inspire school bandana face protection mask improve concept anatomically design shape ultralight quick polyester fabric face unwanted pressure flare neck coverage mention neckwarmer balaclava flat sewn seam mean extra comfort breathable fabric minimize eyewear recyclable common thread recycle program detail ultralight polyester quickly feel good skin fabric provide protection taper design cover neck stay constrict create tight spot flat sewn seam comfort highly breathable fabric minimizes eyewear fogging voice restriction convert headband neck gaiter wristband fabric      polyester jersey protection recyclable common thread recycle program weight      vietnam,-1
412,sunshade shirt ultralight moisture wicke fishing shirt provide cool protection comfort sizzle flat turk caico turn angler high latitude montana maine need shirt like summer fishing      polyester fabric make award sunshade cool light loss rating neck tall collar increase coverage zippered chest pocket hang bulk mesh pocket raglan sleeve recyclable common thread recycle program detail light soft moisture wicke protection fabric build stretch crossover neck tall collar increase coverage zipper chest pocket hang bulk mesh pocket raglan sleeve comfort wader pack straps fabric      polyester jersey moisture wicke performance recyclable common thread recycle program weight vietnam,-1
