id,clean_token,cluster
214,rock guide short tough abrasion resistant rock guide know withstand butt slide descent joshua tree classic clean jerk technical stretch woven nylon soft skin quickly short gussete crotch drop pocket single zippered thigh pocket rear security pocket regular rise inseam size recyclable common thread recycle program detail lightweight stretch woven nylon separate waist pull button closure pocket drop zippered right thigh zippered pocket yoke forward angle seam gussete crotch regular rise inseam size fabric      denier stretch woven nylon spandex deluge durable water repellent finish recyclable common thread recycle program weight      thailand,2
215,serenity tight long soft stretchy unrestricted mobility serenity tight close waist contour slight flare ankle adjustable waist roll hide mini pocket      organic cotton spandex knit inseam size detail soft organic cotton comfort breathability spandex mobility adjustable waist roll seam stealth mini pocket waist slim contour slight flare regular rise inseam fabric      organic cotton spandex knit weight       thailand,-1
216,simple guide skin headlamp summit noon finish late cragge light stretch weave soft shell jacket breathe protect keep pace highly breathable wind resistant double weave blend recycle polyester spandex deluge durable water repellent finish move move moisture stay durable detail microfleece line neck wind flap zippered handwarmer pocket elasticized cuff drawcord recyclable common thread recycle program detail highly breathable wind resistant stretch weave soft shell fabric deluge durable water repellent finish microfleece line neck wind flap skin comfort zipper handwarmer pocket elasticize cuff drawcord fabric      recycle polyester spandex double weave deluge finish recyclable common thread recycle program weight      thailand,0
217,simple guide pant trip patagonia pair pant simple guide deal burly approach burlier condition coarse granite whimper double weave blend recycle polyester spandex deluge durable water repellent finish stretch stride stay durable remain lightweight move sweat breathe resist weather update styling include straight partially elasticize waistband zippered feature include articulate knee gussete crotch help stay limber durable water repellent treat reverse coil zipper pocket thigh rear recyclable common thread recycle program detail lightweight stretch weave fabric      recycle wick moisture breathe quickly resist weather abrasion update style separate partially elasticize waistband zippered durable water repellent finish pocket handwarmer cargo treat reverse coil zippers articulate knee mobility fabric      recycle polyester spandex double weave delugedwr durable water repellent finish recyclable common thread recycle program weight thailand,-1
218,sleeveless shirt cool structured summer tank camisole feminine shirt light weight organic cotton fabric open weave keep circulate crinkle refuse wrinkle yarn plaid quiet open geometry length button placket delicate bind coconut button wear shirt layer recyclable common thread recycle program detail easy care fabric light airy princess seaming shape delicate collar length button placket feminine bind coconut button fabric      organic cotton yarn plain weave recyclable common thread recycle program weight      thailand,-1
219,solid adour adour feature scoop rise line medium coverage improve fabric blend nylon spandex detail medium coverage line slightly scoop rise improve fabric fabric      nylon spandex weight     ,-1
220,solid betina full coverage bottom betina high slightly scoop lined hard wear blend nylon spandex detail full coverage high coverage regular rise improve fabric fabric      nylon spandex weight     ,-1
221,solid bibiana piece sporty bibiana piece racer style shoulder strap keyhole shelf soft coverage line blend nylon spandex detail racer style line shelf soft coverage improve fabric fabric      nylon spandex weight     ,-1
222,solid bibiana athletic bibiana racerback style will impede shoulder blade movement paddle swimming lined elastic underbust band secure support prevent water wash removable entry soft blend nylon spandex detail racerback style line elastic underbust band support removable entry soft improve fabric fabric      nylon spandex weight     ,-1
223,solimar pant case travel plan coincide bite cloudless clarity high pressure cover light weight summer pant soft stretch nylon protection durable water repellent finish shape structure pant button closure waistband belt loop welt patch pocket right thigh mini drop pocket capri length option secure button fastener straight regular rise inseam size recyclable common thread recycle program detail lightweight stretch fabric protection durable water repellent finish waistband belt loops button closure patch pocket welt opening mini drop pocket right thigh straight seaming dart shape fasten button capri length regular rise inseam size fabric nylon spandex protection recyclable common thread recycle program weight      vietnam,2
224,solimar short horny toad professional heat regulator seek shade solimar short provide tightly woven lightweight stretch nylon durable water repellent finish short long roll secure button fastener patch pocket welted opening single thigh mini drop pocket backside seam dart provide shaping straight vent regular rise inseam size recyclable common thread recycle program detail lightweight stretch fabric protection durable water repellent finish waistband belt loops button closure patch pocket welt opening mini drop pocket right thigh straight seaming dart shape regular rise inseam fabric nylon spandex protection recyclable common thread recycle program weight      vietnam,2
225,shirt stifle great basin heat overwhelm bear chill shirt fabric organic cotton crepe like crinkle allow fabric hover skin invite slight breeze subtle yarn plaid soft soothe shaping seam shirt contour sacrifice airflow length button placket feminine bind coconut button provide layering option recyclable common thread recycle program detail fabric light airy easy care princess seaming shape delicate collar length button placket feminine bind coconut button fabric      organic cotton yarn plain weave recyclable common thread recycle program weight      thailand,-1
226,rashguard fabric short sleeve rashguard keep sizzle skin slim neckband seamless underarm gusset sleeve chafe free paddling soft fabric blend recycle polyester spandex solid color match swimwear board short detail stretchy recycle polyester spandex fabric offer protection chafing protection mock neck short sleeve seamless underarm gusset flat seam construction fabric      recycle polyester spandex weight     ,12
227,patrol shirt shirt impossible insult patrol look crisp week road backcountry travel easy drape taper feminine discourage frump fatigue tightly weave polyester block life shirt exceptionally soft lightweight quick hide zippered chest pocket hemostat flap recyclable common thread recycle program detail quick polyester tight weave exceptionally soft light rating protection hide zippered chest pocket flattering princess seaming yoke detail short sleeve hemostat flap fabric      polyester ripstop protection recyclable common thread recycle program weight      vietnam,-1
228,shelter shirt chic sensible shelter save skin deserving fuse protection feminine styling length shelter delicate yoke detail mandarin collar slightly belled sleeve stay roll fine yarn recycle polyester nylon fabric blend protection launder easily overnight soft lightweight wrinkle resistant carry packability recyclable common thread recycle program detail quick recycled polyester nylon blend exceptionally soft light rating protection mandarin collar placket flatter yoke detail feminine appeal fabric      recycle polyester nylon protection recyclable common thread recycle program weight      vietnam,-1
229,super cali short super cali short cool tough sand summit clambering long length short feature wide comfortable waistband belt loop close coconut button slash pocket slung rear patch pocket inseam adjustable cuff organic cotton poplin recyclable common thread recycle program detail organic cotton poplin garment wash softness wide waistband belt loop coconut button slash pocket slung rear patch pocket rise update styling detail inseam fabric      organic cotton poplin recyclable common thread recycle program weight      thailand,-1
230,synch vest possible exception duct tape versatile fleece vest provide color core warmth bulk jacket cushy      double faced polyester fleece      recycle feminine line double fleece collar zippered handwarmer pocket recyclable common thread recycle program detail soft recycled recyclable synchilla fleece feminine contemporary styling zipper handwarmer pocket double fleece collar fabric      polyester      recycle double face fleece recyclable common thread recycle program weight       mexico,-1
231,tranquila capri legging crux cool skin soothe tranquila capris soft organic cotton spandex blend legging flat wide waistband snug contour wear layered solo climbing yoga studio rise inseam size detail soft organic cotton comfort breathability spandex mobility wide flat shape waistband snug hips contour formfitte capri length band cuff knee rise inseam size fabric      organic cotton knit spandex weight      thailand,-1
232,traverse cold rugged mile warm good motivation lightweight traverse pick pace highly breathable soft shell fast drying recycle polyester spandex fabric stretch deluge durable water repellent finish protect weather jacket feature include mesh line stand collar zipper garage wind flap elastic band cuff drawcord waist slight drop tail zippered handwarmer pocket zippered pocket left bicep cord pass reflective logo graphic cuff visible recyclable common thread recycle program detail fast stretch weave polyester soft shell durable deliver stretch deluge durable water repellent finish weather protection mesh line stand collar wind flap zipper garage zipper handwarmer pocket pocket left bicep interior cord pass elastic band cuff drawcord slight drop tail reflective logo chest center fabric      deni recycle polyester spandex mechanical stretch deluge finish recyclable common thread recycle program weight vietnam,0
233,undercover cami morph water creature land dweller effortlessly easy wear undercover cami active minded stretchy organic cotton spandex blend maintain shape build shelf support contour spaghetti style strap will skin hide seam clean smooth look recyclable common thread recycle program detail wash stretchy organic cotton cleanly finish scoop neckline degree shelf strap encase elastic comfort fabric      organic cotton spandex recyclable common thread recycle program weight      turkey,-1
234,vitaliti dress ocean salt scorch body mercy soft slip dress comfort sturdy wrinkle resistant vitaliti fabric blend organic cotton recycle polyester spandex natural easy drape princess seam curved yoke season contoured sophisticated styling active friendly dress build shelf fall knee length strap size recyclable common thread recycle program detail plait organic cotton polyester stretch fabric naturally wrinkle resistant update styling great curve yoke contour seaming build shelf fall knee fabric      organic cotton recycle polyester spandex recyclable common thread recycle program weight      thailand,-1
235,vitaliti skirt long sharp rope shake granite dust hair slip soft stretchy skirt vitaliti fabric sturdy blend organic cotton recycle polyester spandex drape beautifully skirt wide asymmetrical waist faux wrap styling slightly flare silhouette length waist size recyclable common thread recycle program detail plait organic cotton polyester stretch fabric naturally wrinkle resistant wide flat flattering asymmetrical waist faux wrap styling flare silhouette length waist fall knee fabric      organic cotton recycle polyester spandex recyclable common thread recycle program weight      thailand,-1
236,vitaliti tank spray river water sweat thing love vitaliti fabric water work cool skin wick moisture away body quick naturally wrinkle resistant blend      organic cotton recycle polyester spandex high neck tank fuse modesty mobility recyclable common thread recycle program detail plait organic cotton recycle polyester stretch fabric naturally wrinkle resistant self bind neck armhole fabric      organic cotton recycle polyester spandex recyclable common thread recycle program weight       thailand,-1
237,wheat shirt feed urban agrarian sensibility wheat shirt fuse iconic grain abstract symmetry artwork nashville artist mary helt print ringspun organic cotton phthalate free lightweight anika feature long torso form short sleeve wide deep neckline tape shoulder seam prevent chafing recyclable common thread recycle program detail ringspun yarn soft hand tape shoulder seam screen print phthalate free fabric      organic cotton recyclable common thread recycle program weight     ,4
238,wyoming climbing poster factor      vedauwoo wyoming year tribute human adventure near collection photograph speak passion beauty life spend outside photo appear exclusively site catalog wall retail store specialty outdoor clothier world excited select photo available poster hope brighten space inspire outside detail dimensions photo thornburg patagonia fabric print recycle paper print,6
239,yosemite essence shirt artist phyllis shafer gorgeous rendering native heritage infuse yosemite essence shirt print organic cotton ringspun soft hand tape shoulder seam durability double stitch sleeve coverstitche neck armhole clean finish recyclable common thread recycle program fabric detail ringspun yarn soft hand tape shoulder seam screen print phthalate free fabric      organic cotton recyclable common thread recycle program weight     ,4
240,print bayonne rise bayonne bottom adjustable minimal seat coverage style line blend nylon spandex detail coverage line adjustable closure rise improve fabric fabric      nylon spandex weight     ,-1
241,print bibiana tankini bibiana tankini racerback style will impede shoulder blade movement degree shelf secure support length coverage give extra rash protection blend nylon spandex detail racerback style degree shelf length coverage improve fabric fabric      nylon spandex weight     ,-1
242,print bibiana athletic bibiana racerback style will impede shoulder blade movement paddle swimming lined elastic underbust band secure support prevent water wash removable entry soft blend nylon spandex detail racerback style line elastic underbust band support removable entry soft improve fabric fabric      nylon spandex weight     ,-1
243,print boucau halter boucau soft neck adjust personalize wide underbust band offer ample support contouring dart shape removable soft smooth lining clean look blend nylon spandex detail soft neck line wide elastic supportive band bust contouring dart shape removable entry soft improve fabric fabric      nylon spandex weight,-1
244,print kupala triangle bikini kupala adjustable crossover cinch pressure small pleat shape line removable soft durable blend nylon spandex detail triangle swim adjustable crossover line center pleat shape removable entry soft cups fabric      nylon spandex weight,-1
245,runshade shirt backcountry anyplace move comfortable wear runshade shirt keep pace lightweight breathable polyester jersey update well durability wick moisture provide protection quickly collar relaxed bulk protect neck update raglan sleeve panel reduce seam chafing hydration pack strap reflective heat transfer logo keep visible recyclable common thread recycle program detail moisture wicke runshade fabric super soft provide protection relaxed crew collar provide good coverage restrictive raglan sleeve panel seam pack straps reflective heat transfer logo fabric      polyester jersey recyclable common thread recycle program weight      vietnam,-1
246,serenity capri traveler commit carry lifestyle athletic capri grace style yoga studio serenity motion friendly blend organic cotton spandex        substantial excellent breathability wide self fabric waistband roll stealth seam pocket contoured seam eliminate chafe flare slightly mini seam pocket waist inseam size detail soft organic cotton comfort breathability spandex mobility adjustable waist roll seam stealth mini pocket waist slim contour slight flare regular rise inseam size fabric      organic cotton spandex knit weight      thailand,-1
247,serenity tight soft stretchy unrestricted mobility serenity tight close waist contour slight flare ankle adjustable waist roll hide mini pocket      organic cotton spandex knit inseam size detail soft organic cotton comfort breathability spandex mobility adjustable waist roll seam stealth mini pocket waist slim contour slight flare regular rise inseam fabric      organic cotton spandex knit weight       thailand,-1
248,simply organic polo like trumpeter swan simply organic polo relish earth graceful lifestyle organic cotton jersey polo natural stretch classic styling include button placket chest pocket notch self fabric cuff lend durability straight vent recyclable common thread recycle program detail organic cotton jersey button placket notch self fabric cuff chest pocket straight vent fabric      organic cotton jersey recyclable common thread recycle program weight       thailand,-1
249,simply organic tank summer tank beating freshen year crop simply organic tank available print solid wear tank night layer year long organic cotton jersey natural stretch feminine scoop mini placket pearl button zest recyclable common thread recycle program detail organic cotton jersey button placket bind neck sleeve straight vent fabric      organic cotton jersey recyclable common thread recycle program weight      thailand,-1
250,simply organic simply organic survive tough scrape year year make perennial favorite soft organic cotton shirt layer beautifully form flattering feature like feminine crewneck styling sleeve bias great apart standard shirt crowd recyclable common thread recycle program detail organic cotton jersey bias drape contour overlock stitch neck hole appeal fabric      organic cotton jersey recyclable common thread recycle program weight thailand,-1
251,simply organic spring blossom cover hill venture lively simply organic scoop neck shirt organic cotton jersey bias drape contour quarter length sleeve cuff vent mobility overlock stitch neck hole appeal recyclable common thread recycle program detail organic cotton jersey bias drape contour overlock stitch neck hole appeal      length sleeve cuff vent mobility fabric      organic cotton jersey recyclable common thread recycle program weight       thailand,-1
252,solid boucau halter boucau soft neck adjust personalize wide underbust band offer ample support contouring dart shape removable soft smooth lining clean look blend nylon spandex detail soft neck line wide elastic supportive band bust contouring dart shape removable entry soft improve fabric fabric      nylon spandex weight,-1
253,solid kupala triangle bikini kupala adjustable crossover cinch pressure small pleat shape line removable soft durable blend nylon spandex detail triangle swim adjustable crossover line center pleat shape removable entry soft cups fabric      nylon spandex weight,-1
254,solid parie short style parie bottom straight wide side comfort lined seat coverage improve fabric blend nylon spandex detail short style line straight hips update waist styling medium coverage coverage improve fabric fabric      nylon spandex weight     ,-1
255,solid sunamee stay sunamee straight coverage line formfitte blend nylon spandex detail coverage line straight hips regular rise improve fabric fabric      nylon spandex weight     ,-1
256,solimar skirt solimar brief sassy wrap skirt build short skirt school short recess ultralight tightly weave nylon stretch fabric block durable water repellent finish repel water short interior center skirt wrap button closure inside outside cleanly finish skirt welt patch pocket thigh mini drop pocket waist length      size build short inseam recyclable common thread recycle program detail lightweight stretch fabric protection durable water repellent finish wrap skirt build short short slide closure skirt wrap close button patch pocket welt opening mini drop pocket right thigh dart shape length waist short inseam fabric nylon spandex protection recyclable common thread recycle program weight      vietnam,-1
257,patrol shirt ahead bone fishing ride horse desert live like gila monster wear shirt look like patrol lustrous quick exceptionally soft polyester weave extra tightly block rating princess seaming yoke detail feminine touch offer plenty room active casting rein retrieval cleanly style sleeve roll fasten hidden snap shirt secure snap conceal chest pocket zips close hemostat flap recyclable common thread recycle program detail quick polyester tight weave exceptionally soft light rating protection hide zippered chest pocket flattering princess seaming yoke detail roll sleeve fastener hemostat flap fabric      polyester ripstop protection recyclable common thread recycle program weight      vietnam,-1
258,sport loose performance woman sport will hike annoyingly shifty long distance trail mileage extra long seamless racerback tank loose silhouette increase airflow eliminate migration comfortable build sport manage high impact activity nylon spandex        fabric blend provide moisture wicke performance detail supersoft nylon spandex blend skin comfort seamless construction degree build sport perfect length pair short yoga pant everyday style fabric tank       nylon spandex build sport       nylon spandex moisture wicke performance weight       israel,-1
259,meridian board short stretchy meridian board short accommodate floater drop knee turn globe wide waistband snap closure polyester      recycle spandex blend will snag chafe bunch long paddle kelp forest security pocket loop closure mean hunk will lose spin cycle inseam size recyclable common thread recycle program detail stretch weave recycle polyester spandex fabric maximum mobility comfort snap flat closure secure zipper welted pocket drain hole loop rise inseam fabric      recycle polyester spandex recyclable common thread recycle program weight      vietnam,-1
260,merino crew light merino layer silky soft highly durable jersey knit merino wool spin recycle polyester      core super comfortable warm temperature beneath layer cool offer great technical performance naturally resist odor move moisture away skin improve time regulate body temperature maintain consistent stretch neck smooth self fabric bind invite ventilation cover slow wash merino skin softness machine wash cold flat recyclable common thread recycle program detail slow wash merino wool resist odor naturally insulate durable stretch provide superior performance softness      micron gauge yarn jersey knit construction luxurious hand recycle polyester core wick moisture wool skin controls odor softly scoop neckline ventilate cover self fabric neck bind comfort straight machine wash cold flat fabric               micron chlorine free merino wool recycle polyester recyclable common thread recycle program weight     ,8
261,print parie style like short parie bottom straight medium coverage coverage line improve fabric blend nylon spandex detail short style line straight hips update waist styling medium coverage coverage improve fabric fabric      nylon spandex weight     ,-1
262,print sunamee stay sunamee straight coverage line formfitte blend nylon spandex detail coverage line straight hips regular rise improve fabric fabric      nylon spandex weight     ,-1
263,stretch breathe wick warm wonder trail mountain athlete abuse versatile make easy midlayer winter lightweight jacket early spring morning alpine summer evening high interior grid polyester enhance compressibility airflow insulation time jersey microfiber face allow smooth layer zippered handwarmer pocket harness line glue seam internal mesh pocket recyclable common thread recycle program detail versatile fleece provide excellent stretch warmth wicking breathability variety temperature high interior grid structure enhance compressibility airflow time jersey microfiber face allow nonbinde layering center zipper handwarmer pocket fabric        polartec power polyester      recycle spandex recyclable common thread recycle program weight       colombia,-1
264,trail circle globe hand crack stay mobile comfortable warm pullover high grid polyester stretch breathe move moisture insulate sized accommodate light underlayer work stand light midlayer recyclable common thread recycle program detail recycle polyester fabric provide excellent stretch warmth wicking breathability variety temperature wear lightweight insulation thermal baselayer lightweight yarn wick moisture outer microfiber yarns speed evaporation interior grid enhance compressibility airflow jersey microfiber face friction nonbinde layering fabric        polartec power polyester      recycle spandex recyclable common thread recycle program weight       colombia,-1
