id,clean_token,cluster
1,active classic boxer reason boxer cult favorite cool especially sticky situation quick lightweight underwear take minimal space travel pack expose brush waistband offer skin softness panel construction traditional boxer classic functional      recycle polyester moisture wicke performance inseam size         recyclable common thread recycle program detail silky capilene fabric ultralight breathable quick expose brush elastic waistband comfort panel construction traditional boxer inseam size        fabric      recycle polyester gladiodor natural odor control garment recyclable common thread recycle program weight       mexico,-1
2,active sport boxer brief skin glory require movement boxer decide poach route form active sport boxer brief breathable polyester      recycle fabric fast wicking quickly spandex stretch seamless waistband soft edge will roll bind gussete flat inseam size offset prevent inner thigh chafe free smooth panel recyclable common thread recycle program detail stretch mesh provide support open weave mesh airflow wick efficiently fast seamless construction flat gussete inseam forward prevent inner thigh chafe free support inseam size fabric      polyester      recycle spandex moisture wicke performance recyclable common thread recycle program weight      israel,-1
3,active sport brief superbreathable brief minimalist choice high octane endeavor blend fast wicking quick polyester      recycle spandex stretch mesh support open mesh cool airflow soft edging opening seamless waist will roll create friction layer smooth panel opacity recyclable common thread recycle program detail stretch mesh provide support open weave mesh airflow wick efficiently fast seamless construction opening half inch self bind comfort free support fabric      polyester      recycle spandex moisture wicke performance recyclable common thread recycle program weight      israel,-1
4,alpine guide pant skin climb switch rock traverse knife edge ridge boogie durable weather resistant breathable soft shell pant stride mountain endeavor midweight stretch woven polyester will restrict move brushed interior maintain skin comfort zipper keep thing easy harness gussete zippered cuff position snap loop water resistant zippered pocket thigh recyclable common thread recycle program detail durable stretch weave polyester      recycle durable water repellent finish water wind resistant highly breathable brush interior skin comfort waistband belt loop elastic zipper external pocket slash glue thigh highly water resistant finish zippers gussete zipper cuff position adjustable setting loops fabric      deni polyester      recycle spandex deluge finish recyclable common thread recycle program weight      vietnam,0
5,alpine wind high ridge steep alpine jacket serve true good world staple excel stand shell blustery rock climb cool weather trail high output tour condition alpine climb function lightly insulated windshirt approach frictionless midlayer time bundle polyester ripstop shell deluge durable water repellent treatment shed snow block wind smooth lightly brush hang mesh liner wick moisture fast bind baselayer superlight stretch woven underarm panel enhance breathability allow unimpaired motion hand pocket close zipper drawcord elastic cuff heat transfer reflective logo regular coil center zipper finish round feature update season improve recyclable common thread recycle program detail lightweight breathable polyester ripstop fabric deluge durable water repellent finish slightly brush polyester mesh liner wick moisture fast stretch weave underarm panel provide breathability stretch unimpeded range motion finish center zipper elastic cuff pocket exterior chest zipper handwarmer drawcord reflective heat transfer logo fabric shell       deni polyester ripstop panel       deni recycle polyester spandex shell panel deluge durable water repellent finish lining      polyester brush tricot mesh recyclable common thread recycle program weight      china,0
6,ascensionist technical soft shell mountain pursuit strike alpinist balance protection minimalism dense stretch polyester double weave stitchless seam exceptional water wind resistance rapid time superb breathability pare detail provide need adjustable helmet compatible hood reverse coil center zipper durable water repellent finish large external handwarmer pocket zipper garage place harness line internal security pocket articulate self fabic cuff tabs drawcord recyclable common thread recycle program detail dense stretchy polyester double weave fabric exceptionally water wind resistant spandex free fast time stitch free glue seam speed time improve water resistance decrease bulk helmet compatible adjustable hood brush chamois patch chin neck comfort durable water repellent finish center zipper external pocket handwarmer skin zipper garage finish zippers internal security pocket articulate arms profile laminate self fabric cuff tabs drawcord fabric      polyester      recycle double weave stretch deluge finish recyclable common thread recycle program weight      china,0
7,atom multitasker cloud atom play courier daypack carry teardrop shape provide support daypack position load shoulder single strap design make good simple spin large zippered main pocket internal zippered mesh stretch weave pocket convenient zippered pocket shoulder strap line protect valuable breathable moisture move spacer mesh shoulder strap panel denier double weave recycle polyester polyurethane coating durable water repellent finish detail atom spin chest easy access main zippered pocket internal zippered mesh stretch woven organizer pocket small zippered pocket essential zipper pocket shoulder strap line protect cell phone sunglass teardrop shape position weight shoulder ease stress neck spacer mesh shoulder strap panel wick moisture quickly allow circulation waistbelt secure pack torso fabric      deni recycle polyester double weave lining       deni polyester polyurethane coating durable water repellent finish shoulder strap      polyester spacer mesh weight      vietnam,1
8,print band betina full coverage bottom betina high slightly scoop lined blend nylon spandex detail full coverage high coverage regular rise improve fabric fabric      nylon spandex weight     ,-1
9,baby micro luxe cardigan micro luxe heavenly soft fabric earth application cardigan quick durable      polyester      recycle microdeni fleece lightweight breathable work midlayer wind flap back hood cover elastic trim bundle baby deep warmth slash style patch pocket color coordinating elbow patch soft self fabric cuff recyclable common thread recycle program detail soft microdeni fleece recycle polyester durable quick hood stay secure cover elastic inside neck tape clean finish handwarmer patch pocket back wind flap soft self fabric cuff fabric      microdeni polyester      recycle fleece recyclable common thread recycle program weight      costa rica,-1
10,baby bucket rise horizon stay raindrop start fall ultra durable       supplex nylon fabric durable water repellent finish reverse contrast solid color print soft tuck away chin strap hook loop fastener hold securely chafe young jawline pack small easy care detail lightweight supplex nylon soft fast pack small easy care brim shield head neck chin strap hook loop fastener tuck away reversible style print solid combination colorway print side fabric       supplex nylon durable water repellent finish weight      china,-1
11,baby sunshade soft stretchy polyester fabric fast wicke quick breathable detail shoulder relax silhouette extended roll cuff accommodate growth spurt drop waist provide extra coverage fabric      polyester jersey recyclable common thread recycle program weight vietnam,-1
12,baggie short baggie popular short occasionally need update season increase inseam length casual quick water repellent nylon elasticize waistband internal drawstring remain feature include polyester mesh line rear snap pocket pocket self drain mesh corner position reduce drag water inseam size recyclable common thread recycle program detail quick nylon durable water repellent finish elasticize waistband internal drawstre black mesh liner vertical seam pocket reduced drag water pocket quick drain mesh corner snap close pocket inseam fabric      nylon finish lining       polyester mesh recyclable common thread recycle program weight      nicaragua,14
13,beach bucket junction water land neutralize unforgive wide brim soft design versatile beach bucket durable semi rigid foam bill black underneath cast refreshing degree shade      stretch woven nylon fabric look feel like soft canvas provide water shed fast performance detail moisture wicke coolmax headband soft chin strap adjustable rear buckle reliable bond fabric      stretch woven nylon durable water repellent finish detail tough easy care stretch woven nylon brim durable semi rigid foam float bill provide degree protection black underbill reduce glare soft chin strap moisture wicke coolmax headband adjustable rear buckle fabric      stretch woven nylon durable water repellent finish weight      china,-1
14,well sweater june night camp mexico navajo country starry cold layer soft fleece spin date high performance sweater knit polyester fleece well sweater warm wool technically proficient stand collar zipper garage handwarmer pocket finger cozy recyclable common thread recycle program detail soft fleece sweater knit face fleece interior heathere overdye yarns stand collar garage raglan sleeves handwarmer pocket fabric      polyester sweater knit exterior fleece interior recyclable common thread recycle program weight thailand,-1
15,borderless short forward cringe borderless short prying outer reach unnamed terrain light breathable fabric blend nylon      recycle spandex mini ripstop resist effect thrashy chimney provide stretch body language place durable water repellent finish shrug water build protection shade open country feature include gussete crotch preserve mobility pocket access wear harness partially elastic waist short adhere load belt rear welt pocket secure zips inseam size recyclable common thread recycle program detail supple soft blend recycle nylon spandex total mobility light drape fast time abrasion resistance provide protection partially elasticize waistband support wide range motion generous wide entry pocket leave pocket hide internal security pocket welt zipper pocket gussete crotch mobility inseam fabric nylon      recycle spandex durable water repellent finish recyclable common thread recycle program weight      vietnam,2
16,borderless short summertime gift chance freely traverse alpine country short season soft supple weave nylon      recycle spandex mini ripstop stretch energetic move breathe cool airflow gusseted crotch allow wide range motion partially elastic waist keep short adhere load belt slant pocket ensure accessibility harness rear welt pocket secure zips protection inseam size recyclable common thread recycle program detail supple soft blend recycle nylon spandex total mobility light drape fast time abrasion resistance provide protection partially elasticize waistband support wide range motion generous wide entry pocket welt zipper pocket gussete crotch mobility inseam fabric nylon      recycle spandex durable water repellent finish recyclable common thread recycle program weight vietnam,2
17,bucket shade cast prowess bucket provide perfect cover extra large fish taco soft fast nylon water shedding finish repel rain ocean spray bucket feature time test design linear crown crushable brim ventilation hole noggin hard boiling roll inside pocket detail lightweight fast easy care fabric durable water repellent finish shed rain ocean spray crushable degree brim provide complete protection roll inside pocket fabric      nylon durable water repellent finish weight      china,-1
18,bottom spring skiing transient wind fast light stay light weight capilene performance baselayer bottom wick perspiration breathe quickly shell insulate overheat waistband brush softness inseam forward prevent chafe gusseted crotch improve mobility functional      recycle polyester gladiodor natural odor control garment protection recyclable common thread recycle program detail silky soft capilene light technical baselayer fabric fast highly breathable sleek provide protection wear layer cool temp elastic waistband brush skin softness streamline functional inseam forward prevent chafe fabric      recycle polyester gladiodor natural odor control garment protection recyclable common thread recycle program weight     ,3
19,boxer brief bivy belay form fitting capilene boxer brief stay comfortable recycle polyester underwear excel moisture wicke gladiodor natural odor control garment expose elastic waistband brush softness coverstitche smooth glide beneath short pant fully function supportive panel cover          inseam size recyclable common thread recycle program detail moisture wicke capilene fabric gladiodor exceptional skin comfort natural odor control garment brush elastic waistband supportive panel cover stitch smooth glide short pant will restrict mobility inseam size        fabric      recycle polyester gladiodor natural odor control garment recyclable common thread recycle program weight     ,3
20,graphic shirt light weight capilene fabric achieve harmonic balance technical ability slacker prowess design cool comfort protection highly breathable fast silky feel knit collar soft skin raglan sleeve reduce chafing pack tuckable length sublimated graphic will impede breathability      recycle polyester gladiodor natural odor control garment protection recyclable common thread recycle program detail silky soft capilene light technical baselayer fabric fast highly breathable sleek provide protection wear layer cool temp knit collar soft skin graphic element sublimate fabric will impede breathability wicking performance sleeve long tuck fabric      recycle polyester gladiodor natural odor control garment protection recyclable common thread recycle program weight     ,3
21,shirt minimally style technically evolve punish expanse country silky ultra breathable capilene shirt quick wick fast knit collar soft skin generous long tuck      recycle polyester gladiodor natural odor control garment protection recyclable common thread recycle program detail silky soft capilene light technical baselayer fabric fast highly breathable sleek provide protection wear layer cool temp knit collar soft skin sleeve long tuck fabric      recycle polyester gladiodor natural odor control garment protection recyclable common thread recycle program weight      ,3
22,shirt revel sweat jamboree hill climbs ridge desert singletrack resolute fast drying performance baselayer fabric open knit invite airflow provide excellent wicking exceptional breathability wear beneath layer insulative chilly self bind neck pliable soft raglan sleeve flat ribbed underarm panel merge strap eliminate chafe polyester      recycle gladiodor natural odor control garment recyclable common thread recycle program detail capilene fabric open knit invite airflow provide excellent wicking endurance activity warm moderate temperature fast capilene fabric insulate chilly wear beneath layer self fabric neckline soft skin raglan sleeve underarm panel merge pack strap flat panel piece side exceptionally breathable fast eliminate armpit seam chafing fabric polyester      recycle gladiodor natural odor control garment recyclable common thread recycle program weight       mexico,3
23,neck design chill pursuit like backcountry alpine climbing mountain trek fast performance baselayer cool endurance activity warm temperature insulate turn dark open knit invite airflow provide excellent wicking exceptional breathability draft flap back zipper raglan sleeve eliminate chafe pack strap flat panel merge flat offset seam chafe free comfort polyester      recycle gladiodor natural odor control garment recyclable common thread recycle program detail capilene fabric open knit invite airflow provide excellent wicking endurance activity warm moderate temperature fast capilene fabric insulate chilly wear beneath layer neck easy climate control back draft flap zipper garage raglan sleeve underarm panel merge pack strap flat panel piece side exceptionally breathable fast eliminate armpit seam chafing fabric polyester      recycle gladiodor natural odor control garment recyclable common thread recycle program weight      mexico,3
24,neck capilene provide excellent insulation skin comfort endurance activity cool cold condition dense interior honeycomb construction brush warmth softness compressibility smooth jersey exterior glide readily beneath layer raglan sleeve single piece shoulder panel merge shoulder strap seam roll forward panel offset eliminate chafe neck back draft flap zipper garage make easy climate control      polyester      recycle gladiodor natural odor control garment recyclable common thread recycle program detail fast wicking baselayer fabric capilene feature dense interior honeycomb construction fabric skin brush warmth softness compressibility provide excellent insulation breathability smooth jersey exterior glide easily layer neck easy climate control back draft flap zipper garage raglan sleeve single piece shoulder panel merge pack strap seam roll forward comfort belt fabric      polyester      recycle gladiodor natural odor control garment recyclable common thread recycle program weight       costa rica,3
25,bottom sufferfest like grand january pair warm bottom bright grief warm synthetic performance baselayer capilene fabric stretchy compressible smooth jersey exterior glide easily beneath layer cozy internal grid trap warmth wick moisture highly breathable brush elastic waistband soft skin      polartec power polyester      recycle spandex gladiodor natural odor control garment recyclable common thread recycle program detail warm baselayer fabric capilene offer stretch great breathability compressibility interior grid wick moisture trim bulk provide warmth smooth jersey face slide easily beneath layer panel construction pull tight elastic waistband brush skin softness fabric      polartec power polyester      recycle spandex gladiodor natural odor control garment recyclable common thread recycle program weight      costa rica,3
26,city shirt illustrate renaissance inspire community live artist geoff mcfetridge work adorn city shirt lightweight      organic cotton fabric ringspun softness tape shoulder seam prevent chafing phthalate free easy environment recyclable common thread recycle program detail ringspun yarn soft hand tape shoulder seam screen print phthalate free fabric      organic cotton recyclable common thread recycle program weight     ,4
27,compound cargo pant long ultimate pant build withstand daily abuse cargo pocket model vintage army block compound cargo perfect trail stash climbing shoe multitool spare salami beer additional pocketing include generous drop rear hidden button flap closure tough      organic cotton ripstop tear strength standard material hardy lightweight ready action inseam size short      regular      long      recyclable common thread recycle program detail lightweight durable organic cotton ripstop feature block generous wide entry drop pocket seam cargo pocket hidden button flap rear pocket hidden button flap inseam fabric      organic cotton ripstop recyclable common thread recycle program weight thailand,-1
28,compound cargo pant ultimate pant build withstand daily abuse cargo pocket model vintage army block compound cargo perfect trail stash climbing shoe multitool spare salami beer additional pocketing include generous drop rear hidden button flap closure tough      organic cotton ripstop tear strength standard material hardy lightweight ready action inseam size short      regular      long      recyclable common thread recycle program detail lightweight durable organic cotton ripstop feature block generous wide entry drop pocket seam cargo pocket hidden button flap rear pocket hidden button flap inseam fabric      organic cotton ripstop recyclable common thread recycle program weight      thailand,-1
29,continental short wrinkle resistant travel short great mountainside museum garment wick moisture quickly look sharp successive continental deploy classic guide fabric tough agile blend polyester nylon durable water repellent finish detail include drop pocket cargo rear pocket zipper closure hook loop velcro closure regular inseam size         recyclable common thread recycle program detail wrinkle resistant fast polyester nylon blend button closure drop pocket rear cargo pocket right zipper leave hook loop closure seam cargo pocket zippered security hook loop easy access finish inseam        fabric      polyester nylon finish recyclable common thread recycle program weight       vietnam,2
30,cotton board short classic fabric form      organic cotton brush canvas board short provide lightweight durability water pattern inspire plantation cane field workshirt self fabric waistband flat button cleanly style flap patch pocket metal button closure double needle stitch seam inseam size outseam recyclable common thread recycle program detail hawaiian classic fabric form fabric pattern inspire plantation cane field workshirt self fabric waistband flat button flap patch pocket metal button closure double needle stitch seam inseam size outseam available size fabric      organic cotton brush canvas recyclable common thread recycle program weight      thailand,-1
31,crosstown crosstown cross country fully feature commuter backpack ensure life stay organize office bind hike steep narrow global commute inside zippered main compartment feature suspend self adjust padded laptop sleeve handle laptop secondary zippered compartment open portable office organizer system catch sleeve hidden zipper provide easy access document stretch weave water bottle pocket fleece line pocket protect sunglass electronic spacer mesh backpack strap padding comfort breathability adjustable sternum strap build safety whistle denier recycle polyester double weave polyurethane coating durable water repellent finish detail large zippered main compartment fully suspend laptop sleeve separate internal mesh organizer sleeve second zippered compartment office organizer pocket catch sleeve hide zipper provide easy access document ticket important material organizer pocket detachable chain stretch weave water bottle pocket fleece line pocket sunglass electronic spacer mesh strap wick moisture quickly allow circulation shoulder strap slot clip attachment adjustable sternum strap build safety whistle carrying handle stowable attachment straps hold        laptop fabric      deni recycle polyester double weave lining       deni polyester polyurethane coating durable water repellent finish shoulder strap      polyester spacer mesh weight      vietnam,1
32,custodian pant long graveyard shift advantage quit time dawn patrol custodian pant define strong work ethic tough comfortable      organic cotton canvas flat generous wide entry pocket welt pocket button closure inseam size short      regular      long      recyclable common thread recycle program detail lightweight organic cotton canvas button closure flat offset seam generous wide entry pocket welt pocket inseam fabric      organic cotton canvas recyclable common thread recycle program weight      thailand,5
33,deep wade chase olympic peninsula chrome reach striper break simply jump deep ultra lightweight jacket waist wade minimalist design need waterproof breathable fishing shell addition visibility hood reverse stretchcoat cuff roomy zippered pocket feature fleece lined handwarmer pocket tough      layer ripstop nylon waterproof breathable barrier short fishing jacket deep wading relaxed accommodate layer loaded vest detail      layer tear resistant nylon deluge durable water repellent finish waterproof breathable barrier seal seam packable lightweight visibility houdini drawcord hood single pull adjustment drawcord waist drain hole external zippered chest pocket high wade drain hole brush polyester line handwarmer pocket hang accessory loop inside right pocket glue coated reverse coil main chest pocket zipper highly water resistant gussete reverse stretchcoat cuff internal mesh pocket ring hidden daisy chain leave label fabric shell       layer       deni nylon ripstop waterproof breathable barrier deluge finish cuff reverse stretchcoat weight      vietnam,-1
34,delivery short local know good spot delivery short build comfort durability simple practical style blend recycle polyester organic cotton design local deliveryman feature include flat offset seam button closure generous wide entry pocket welt pocket inseam size recyclable common thread recycle program detail soft durable recycle polyester blend organic cotton button closure flat offset seam generous wide entry pocket welt pocket inseam fabric recycle polyester organic cotton recyclable common thread recycle program weight      vietnam,5
